<?xml version="1.0" encoding="UTF-8"?>
<xsd:schema xmlns:xsd="http://www.w3.org/2001/XMLSchema">

    <xsd:element name="stock">
        <xsd:complexType>
            <xsd:sequence>
                <xsd:element name="produit" maxOccurs="unbounded">
                    <xsd:complexType>
                        <xsd:sequence>
                            <xsd:element name="nom" type="xsd:string"/>
                            <xsd:element name="description" type="xsd:string"/>
                            <xsd:element name="quantite">
                                <xsd:simpleType>
                                    <xsd:restriction base="xsd:integer">
                                        <xsd:minInclusive value="1"/>
                                    </xsd:restriction>
                                </xsd:simpleType>
                            </xsd:element>
                            <xsd:element name="prix">
                                <xsd:simpleType>
                                    <xsd:restriction base="xsd:decimal">
                                        <xsd:minInclusive value="0.01"/>
                                    </xsd:restriction>
                                </xsd:simpleType>
                            </xsd:element>
                            <xsd:element name="categorie" type="xsd:string"/>
                        </xsd:sequence>
                        <xsd:attribute name="id" type="xsd:integer" use="required"/>
                    </xsd:complexType>
                </xsd:element>
            </xsd:sequence>
        </xsd:complexType>
    </xsd:element>

</xsd:schema>
